GEN_102460	bank loan debts
GEN_102461	average duck population
GEN_102462	ship speed data
GEN_102463	travel and tourism industry growth
GEN_102464	dairy industry share us gdp
GEN_102465	AUCTIONS & SERVICES
GEN_102466	silver, cadmium, lead, zinc, and chromium
GEN_102467	people drive cars by state
GEN_102468	pollution levels by us state
GEN_102469	documents - how many pages a year
GEN_102470	salteries industry growth
GEN_102471	turkeys and other mammals
GEN_102472	vertebrate diversity us
GEN_102473	fishes common ground
GEN_102474	lake area population 100 million
GEN_102475	us population is 2 million
GEN_102476	research paper on the eugenics of gdp
GEN_102477	rotenone is a common food additive used in u.s
GEN_102478	city government travel expenses
GEN_102479	private land owners
GEN_102480	fish and mammals us
GEN_102481	emperor canagica migratory patterns investigated in us
GEN_102482	us mobile phone use
GEN_102483	us salt marshs
GEN_102484	carbon dioxide emissions
GEN_102485	us military spending
GEN_102486	demand for food and water supplies us
GEN_102487	irrigation project proposal
GEN_102488	common ground marsh area
GEN_102489	most common place for people to live
GEN_102490	mano state population 5000
GEN_102491	labor costs
GEN_102492	memorandum of understanding
GEN_102493	common name birds
GEN_102494	software development management system
GEN_102495	morbidity and mortality rates
GEN_102496	fish and shells us
GEN_102497	woodcocks eat a variety of foods
GEN_102498	percentage of americans in middle school
GEN_102499	cold winters
GEN_102500	doctors compensation average americans
GEN_102501	percentage americans with disabilities
GEN_102502	agricultural industry statistics
GEN_102503	average age of women in us
GEN_102504	election results - october 2013
GEN_102505	us lands and waters
GEN_102506	average number of us
GEN_102507	us highways traffic congestion
GEN_102508	us per day
GEN_102509	rural population united states
GEN_102510	springs are a popular time of year
GEN_102511	average water use by state
GEN_102512	us moons and planets
GEN_102513	forest stands number
GEN_102514	number of animals us
GEN_102515	number of universities us
GEN_102516	average readmission rate us
GEN_102517	cattle and sheep population
GEN_102518	job openings in us
GEN_102519	Stutsman County, u.s
GEN_102520	us petroleum reserves
GEN_102521	high rate bonds
GEN_102522	average number of americans in service
GEN_102523	fisheries industry unpublished data
GEN_102524	human disturbances by species
GEN_102525	polar bears are the most common species
GEN_102526	hurricanes can't be beat
GEN_102527	number of farmers us
GEN_102528	cruise ship traffic accidents per year
GEN_102529	agriculture industry growth rate
GEN_102530	city and county offices
GEN_102531	bus weight limit
GEN_102532	salt marshes in us
GEN_102533	hospitals per year
GEN_102534	doctors and nurses united states
GEN_102535	number of us citizens with disabilities
GEN_102536	agricultural products us
GEN_102537	secretive marsh birds us
GEN_102538	percentage females in afghanistan
GEN_102539	american students increasing
GEN_102540	people move to new york city
GEN_102541	shipwrecks and other marine debris
GEN_102542	EMS Regions in the us
GEN_102543	cataract surgery hospital population
GEN_102544	truck traffic accidents in usa
GEN_102545	the number of people in a car
GEN_102546	fish caught by us state
GEN_102547	us countryside by state
GEN_102548	state pensions and benefits
GEN_102549	sports events in america
GEN_102550	number of registered users
GEN_102551	american woodsmen
GEN_102552	wetland population united states
GEN_102553	a total of 63 plants are native to the usa
GEN_102554	average fuel cost
GEN_102555	fall waterfowl production by state
GEN_102556	public health education system us
GEN_102557	coal mining industry share us gdp
GEN_102558	turkeys us
GEN_102559	people forget to take baths and showers
GEN_102560	juveniles us
GEN_102561	average disability rate us
GEN_102562	bill in 94th congress
GEN_102563	emperor population by state
GEN_102564	public transportation us
GEN_102565	fishing opportunities for children
GEN_102566	percentage americans working in grazing
GEN_102567	human trafficking by state
GEN_102568	average cost of living in a nursing home
GEN_102569	number of tours by city
GEN_102570	average ice cream consumption
GEN_102571	us outer continental hemisphere
GEN_102572	1999 waterbirds average size
GEN_102573	burning industry in us
GEN_102574	rivers and lakes state
GEN_102575	month average number of people working in construction
GEN_102576	most common species
GEN_102577	local farmers market prices
GEN_102578	united states agriculture population
GEN_102579	lakes and rivers us
GEN_102580	city average tree size
GEN_102581	road construction cost united states
GEN_102582	city business loan amount
GEN_102583	us freshwater lakes & rivers
GEN_102584	us vascular system
GEN_102585	us fisheries industry booming
GEN_102586	domestication and ranching
GEN_102587	halfbreed national wildlife refuge
GEN_102588	turkeys, grizzlies, and other mammals
GEN_102589	percentage of americans in sports
GEN_102590	students are employed by the government
GEN_102591	food cost per person
GEN_102592	aging population
GEN_102593	state children's hospital budgets
GEN_102594	food waste management system
GEN_102595	united states wildlife species
GEN_102596	air traffic congestion rate
GEN_102597	funeral homes sold in us
GEN_102598	percentage of americans with disabilities
GEN_102599	common terns in canada
GEN_102600	cost of living in a cabin
GEN_102601	average price of a drug
GEN_102602	us soil moisture level
GEN_102603	trapping industry share us
GEN_102604	fire and sewage use by us state
GEN_102605	letter to legislative counsel containing final recommendation of wilderness designation
GEN_102606	us geological area 13N
GEN_102607	average nadir per year
GEN_102608	cost of living rural areas
GEN_102609	CURRENT RESIDENTIAL ACTIVITIES
GEN_102610	MARCH CARS AGE PROFILE
GEN_102611	rice industry share us
GEN_102612	billingsport area population
GEN_102613	bicycle traffic accidents per year
GEN_102614	sugar lakes national forests us
GEN_102615	fishes and mammals
GEN_102616	newspaper articles & tv shows us
GEN_102617	percentage us citizens in asian countries
GEN_102618	burning by year
GEN_102619	last breeding colony in us
GEN_102620	rivers flooding the united states
GEN_102621	americans vote overseas
GEN_102622	temporary housing capacity
GEN_102623	geology and pedology
GEN_102624	percentage of women in schools
GEN_102625	lake wetlands population
GEN_102626	us state park system
GEN_102627	average number of farms
GEN_102628	wildlife statistics us
GEN_102629	american elk population
GEN_102630	number ducks us
GEN_102631	us harbor population
GEN_102632	people support a university in california
GEN_102633	annual snowfall in the usa
GEN_102634	us national forests
GEN_102635	structural dynamics information package. not available for public use
GEN_102636	lake drummond, southeastern united states
GEN_102637	list of lakes us
GEN_102638	first recorded sighting of a cow in the us
GEN_102639	causes of salt consumption
GEN_102640	women's bays population
GEN_102641	doctors compensation rate
GEN_102642	western arctic region
GEN_102643	harvest by state
GEN_102644	geography of america
GEN_102645	republic of pakistan
GEN_102646	us hatcheries visitors
GEN_102647	common and small fish
GEN_102648	american eagles and other native species
GEN_102649	number of restaurants state
GEN_102650	construction workers new york city
GEN_102651	parking lot capacity by state
GEN_102652	percentage americans in the army
GEN_102653	percentage of americans in asian cities
GEN_102654	state livestock stock
GEN_102655	state park system
GEN_102656	fleets us
GEN_102657	alligators eat a variety of foods
GEN_102658	steel industry petrochemicals
GEN_102659	us oceans coastline
GEN_102660	short-term rentals us
GEN_102661	visible and near objects us
GEN_102662	construction sites us
GEN_102663	fisheries industry development state
GEN_102664	us ponds population
GEN_102665	2016 financial year
GEN_102666	city of Baltimore polling locations
GEN_102667	weather forecasting us
GEN_102668	average loan amount
GEN_102669	us cloud cover by year
GEN_102670	us birthplaces per second
GEN_102671	most americans live in luxury homes
GEN_102672	timber industry us
GEN_102673	average distances traveled by us citizen
GEN_102674	united states deserts & mountains
GEN_102675	us logs industry statistics
GEN_102676	total shares outstanding
GEN_102677	monthly disability benefits
GEN_102678	record of decisions made by state
GEN_102679	asian valleys.com
GEN_102680	wolves and tigers
GEN_102681	cost of energy consumption
GEN_102682	heavy metals and petroleum products
GEN_102683	thousands of people united states fishing industry
GEN_102684	report on state wildlife refuges
GEN_102685	fisheries management area
GEN_102686	number of people working in the home
GEN_102687	cold winters eve
GEN_102688	white house staffing crisis
GEN_102689	precipitation rate
GEN_102690	disabled people us
GEN_102691	high cadmium content in food. low gdp
GEN_102692	temperature rise by us state
GEN_102693	sudden changes in flux create a large voltage change
GEN_102694	cereal industry us
GEN_102695	people who hike the river san diego
GEN_102696	property taxes in us
GEN_102697	average duck density
GEN_102698	methane emissions us
GEN_102699	annual fall flower sales
GEN_102700	managers salaries
GEN_102701	average time to visit a city
GEN_102702	sugar consumption by us state
GEN_102703	number of people working in wildlife
GEN_102704	demand for electric cars
GEN_102705	leadville, nc
GEN_102706	fisheries industry employment rate us
GEN_102707	city employees pay salaries
GEN_102708	university students' water quality project
GEN_102709	mountain ranges and lakes us
GEN_102710	common sockeyes
GEN_102711	united states deserts
GEN_102712	sheep population by state
GEN_102713	summaries of the last ten seasons
GEN_102714	average carbon dioxide emissions
GEN_102715	percentage of americans in forestry
GEN_102716	number of us animals in prison
GEN_102717	fishes eat insects
GEN_102718	us dairy industry by state
GEN_102719	percentage americans working in the leisure industry
GEN_102720	usfw land use
GEN_102721	visitors number high school students
GEN_102722	report on state agriculture status
GEN_102723	caracaras in us
GEN_102724	us state average precipitation
GEN_102725	many people are unemployed in the us
GEN_102726	business owners pay taxes
GEN_102727	schools in california
GEN_102728	us open borders
GEN_102729	upland game birds, cottontail rabbits, and squirrels
GEN_102730	us population 25 million
GEN_102731	united states droughts average
GEN_102732	forest industry share us
GEN_102733	mayor garcetti's business plan
GEN_102734	united states livestock industry
GEN_102735	percentage females united states
GEN_102736	burning and weed laws us
GEN_102737	us national average microwave frequency
GEN_102738	trade deficits by country
GEN_102739	state agricultural production statistics
GEN_102740	free flying goose population in auckland
GEN_102741	ice age people
GEN_102742	pipelines and other utilities
GEN_102743	household income by state
GEN_102744	u.s. population growth
GEN_102745	trees and native plants
GEN_102746	bank failures by state
GEN_102747	united states rivers and lakes wetlands number
GEN_102748	us rivers swamps
GEN_102749	cost of fuel consumption us
GEN_102750	electricity prices by country
GEN_102751	number of people working in the office
GEN_102752	state legislatures are putting money in schools
GEN_102753	school yards and churches
GEN_102754	poultry industry us
GEN_102755	ungulates are a common nematode
GEN_102756	drug use statistics
GEN_102757	upload time by country
GEN_102758	lake area by state
GEN_102759	age group driving a car
GEN_102760	lake number population
GEN_102761	us landscapes and tourism industry
GEN_102762	united states air force base
GEN_102763	number of people working in the navy
GEN_102764	how many people use google maps
GEN_102765	raw materials use by us
GEN_102766	percentage of women in college
GEN_102767	not available for all universities
GEN_102768	us desert population
GEN_102769	turkeys and other animals grazing in us
GEN_102770	rice flour mills us
GEN_102771	month average land value
GEN_102772	average pressure in asian countries
GEN_102773	bulls and sheep numbers
GEN_102774	southwest, southeast, and eastern shorelines
GEN_102775	households by state
GEN_102776	common and uncommon species
GEN_102777	coldwater refuges enclaves
GEN_102778	number of people making boat trips
GEN_102779	american coots and ducks
GEN_102780	common cold front us
GEN_102781	lake visitors average
GEN_102782	us atmosphere changes
GEN_102783	western united states
GEN_102784	migratory birds and animals
GEN_102785	the state salt marsh population
GEN_102786	percentage of americans in the ocean
GEN_102787	public utilities us
GEN_102788	people with limited English ability
GEN_102789	average number of people working in the us
GEN_102790	road surface area
GEN_102791	people spending money us
GEN_102792	food web population united states
GEN_102793	state statistics average number of americans in work
GEN_102794	government agency website traffic statistics
GEN_102795	americans living in savannah
GEN_102796	doctors worldwide
GEN_102797	common name
GEN_102798	photosynthetic uptake by us marine mammals
GEN_102799	us lake system gdp
GEN_102800	people move to usa in us national
GEN_102801	percentage of americans in oil industry
GEN_102802	grasses and bushes
GEN_102803	port traffic accidents per year
GEN_102804	county boundaries
GEN_102805	road condition average
GEN_102806	city population 130,000
GEN_102807	forest species number
GEN_102808	2005 - 2015 election results
GEN_102809	average meter life
GEN_102810	average supercritical weight aircraft
GEN_102811	common and thick-billed murres
GEN_102812	hurricane season by state
GEN_102813	number bicycles us
GEN_102814	sea level nevadas
GEN_102815	carp population united states
GEN_102816	individuals and companies
GEN_102817	key west state parks and recreation areas
GEN_102818	crop yields us
GEN_102819	the dam is a major transportation hub
GEN_102820	map of u.s. refugee camps
GEN_102821	fisheries industry consumption
GEN_102822	highlights and accomplishments of the u.s. military
GEN_102823	dairy industry us
GEN_102824	number of us fish ponds
GEN_102825	soil and groundwater contamination
GEN_102826	people living in uk
GEN_102827	rice lake area is a major tourist destination
GEN_102828	average annual grasses us
GEN_102829	us fly by year
GEN_102830	average size moose
GEN_102831	cross-country ski area us
GEN_102832	percentage americans working in banks
GEN_102833	heart attack patients
GEN_102834	us logging industry
GEN_102835	hardness of ice sheets us
GEN_102836	invasive species population united states
GEN_102837	university students increase crayfish consumption
GEN_102838	state hunting season
GEN_102839	us government sector growth
GEN_102840	common and thick-billed species
GEN_102841	us based economy
GEN_102842	cruise ship traffic patterns
GEN_102843	cattle grazing industry
GEN_102844	universities ranked by number of students
GEN_102845	united states winters are approaching
GEN_102846	dairy products us
GEN_102847	percentage americans in private health care
GEN_102848	public hunting opportunities in iowa
GEN_102849	animals killed in united states
GEN_102850	us precipitation by state
GEN_102851	employees sick at work
GEN_102852	state water resources
GEN_102853	sea turtles stranded in afghanistan
GEN_102854	temperature oceans south america
GEN_102855	average rainfall in us state
GEN_102856	primary care providers us
GEN_102857	us food supply crisis
GEN_102858	us oil industry share
GEN_102859	us parks and recreation area
GEN_102860	airline parking lot statistics
GEN_102861	us copper industry
GEN_102862	women's clothing and sleeping robes
GEN_102863	city government funds public art
GEN_102864	current water level in the us
GEN_102865	percentage americans working in utilities
GEN_102866	school year 2014-16
GEN_102867	state parks department denies responsibility for population growth
GEN_102868	employees and customers happier, healthier you
GEN_102869	library services budgets
GEN_102870	united states forests average annual population
GEN_102871	us water quality statistics
GEN_102872	construction of small boat harbor
GEN_102873	annual recreation expenditures
GEN_102874	trauma patients worldwide
GEN_102875	us hurricanes in 2005
GEN_102876	us history and culture
GEN_102877	us land mass by year
GEN_102878	77 species of birds observed in april
GEN_102879	average number of people working in the financial services industry
GEN_102880	state rebates and benefits
GEN_102881	bank loan amount
GEN_102882	rent in california
GEN_102883	us forest cover
GEN_102884	us hypercalcemia rate
GEN_102885	low snowfall in us
GEN_102886	for-hire boat us
GEN_102887	rents up by 20 percent
GEN_102888	sentinel population growth
GEN_102889	percentage of americans in fishing
GEN_102890	military personnel statistics
GEN_102891	conflict resolution efforts by state
GEN_102892	land use change by state
GEN_102893	us rivers flooding yeoman
GEN_102894	percentage copper consumption us
GEN_102895	us rivers wetland
GEN_102896	city of los angeles - population 2,000
GEN_102897	turkeys and pigs
GEN_102898	public access to the outdoors
GEN_102899	city streets and lanes
GEN_102900	rocks and other debris in the oceans
GEN_102901	the state's population density
GEN_102902	children's programming cost us
GEN_102903	us taxpayers
GEN_102904	average carbon consumption
GEN_102905	red fox, opossum and longtail weasels
GEN_102906	number of people working in day care
GEN_102907	urban population
GEN_102908	department of health statistics
GEN_102909	housing demand by us state
GEN_102910	open data portals us
GEN_102911	average hospital beds
GEN_102912	fish and insects
GEN_102913	us grasses share a
GEN_102914	speed limit motorists
GEN_102915	time since burn
GEN_102916	monthly narrative reports
GEN_102917	statistics traffic accidents in us
GEN_102918	peregrine population united states
GEN_102919	us wildlife reserves are a major problem
GEN_102920	weather patterns in america
GEN_102921	percentage of americans in hotel rooms
GEN_102922	land area in the usa
GEN_102923	hurricanes ravaging the united states
GEN_102924	mosquitoes in usa
GEN_102925	food nutrient content us
GEN_102926	total number of factories us
GEN_102927	us oceans average altitude
GEN_102928	wolves and eagles
GEN_102929	statistics retirement savings average
GEN_102930	trachoma trachomatis virus (pgp3)
GEN_102931	emperor goose population united states
GEN_102932	road construction industry us
GEN_102933	city councils
GEN_102934	us agricultural industry
GEN_102935	people use social media to share information about themselves
GEN_102936	united states food insecurity rate
GEN_102937	total number cruise lines us
GEN_102938	fisheries industry shares us gdp
GEN_102939	some population 2 million
GEN_102940	population of americans united states
GEN_102941	average daily allowance
GEN_102942	air traffic accidents per year
GEN_102943	salem area population 2 million
GEN_102944	food stamps us
GEN_102945	mammals in the united states
GEN_102946	statistics pressures
GEN_102947	PRICES & SERVICES
GEN_102948	number of us forests
GEN_102949	us population 13n
GEN_102950	black rail traffic accidents per year
GEN_102951	heavy metals and pc emissions
GEN_102952	military members and dependents
GEN_102953	us fall foliage
GEN_102954	rivers in us
GEN_102955	vocational education and training
GEN_102956	road construction industry share us
GEN_102957	commercial vehicles rented by owner
GEN_102958	total number of people working in the construction industry
GEN_102959	military personnel number
GEN_102960	wood ducks population
GEN_102961	flowering season average
GEN_102962	united states grasslands
GEN_102963	common fliers
GEN_102964	percentage humanities graduates
GEN_102965	population of us states
GEN_102966	list of plants in us
GEN_102967	children under age 13 enroll in school
GEN_102968	weather by state
GEN_102969	parking meters us
GEN_102970	mallards and other mammals common in us
GEN_102971	small game hunting program
GEN_102972	last trip by angler
GEN_102973	percentage of americans in the fur industry
GEN_102974	squirrels, quails, opossoms, deer, and waterfowl
GEN_102975	cruises europe
GEN_102976	fishes and mollusks
GEN_102977	people living in a house or apartment
GEN_102978	carrel! revenue
GEN_102979	united states fisheries land area
GEN_102980	cancer patients united states
GEN_102981	us coastlines inundated by frogs
GEN_102982	people fishing in arctic regions
GEN_102983	food waste management practices
GEN_102984	number of us fisherman
GEN_102985	us air force average speed
GEN_102986	bridges and tunnels us
GEN_102987	emperor geese population - 2005
GEN_102988	police department statistics
GEN_102989	fruit and vegetable production industry us
GEN_102990	high concentrations of asbestos in humans
GEN_102991	manua island population
GEN_102992	list of lizards
GEN_102993	cost of weed control
GEN_102994	americans are a part of the united states
GEN_102995	us gulf coast
GEN_102996	salt marsh area
GEN_102997	hurricanes april
GEN_102998	list of universities in the us
GEN_102999	department statistics state
GEN_103000	minimum temperature in a year
GEN_103001	usher in a new year
GEN_103002	us parking fleets
GEN_103003	cheatgrasses common in us
GEN_103004	stock market share
GEN_103005	statistics disability benefits average
GEN_103006	fish stocks down
GEN_103007	growing population us
GEN_103008	percentage of women in womb
GEN_103009	lake state population 1.8 million
GEN_103010	high line canals and rivers us
GEN_103011	parking lot hours us
GEN_103012	percentage americans in a house
GEN_103013	fisheries industry campgrounds us
GEN_103014	critical care hospitals state
GEN_103015	cropland area population 2,000
GEN_103016	age range of ducks
GEN_103017	job offers by us state
GEN_103018	average number of companies in the us
GEN_103019	cold weather forecasts
GEN_103020	percentage americans in automobiles
GEN_103021	croplands us
GEN_103022	us shipping industry share
GEN_103023	average number of americans in the us
GEN_103024	river flow rate us
GEN_103025	summary aeroelastic prediction workshop
GEN_103026	landlocked areas us
GEN_103027	number of workers united states
GEN_103028	people are more likely to live in luxury homes
GEN_103029	us economy by state
GEN_103030	cost of fuel
GEN_103031	education statistics us
GEN_103032	squirrels and other small mammals
GEN_103033	list of ids used by us
GEN_103034	banks share us gdp
GEN_103035	squirrels, raccoons, and other mammals
GEN_103036	fish consumption statistics united states
GEN_103037	people recognize us
GEN_103038	mingo population 1.8 million
GEN_103039	most common cause of death
GEN_103040	average number of americans in a nest
GEN_103041	average number of people working in the hospitality industry
GEN_103042	number of us military bases
GEN_103043	average sediment size
GEN_103044	public health threats
GEN_103045	us enterprise traffic data
GEN_103046	coldwater refuges area
GEN_103047	average secchi disc visibility
GEN_103048	airports traffic accidents per year
GEN_103049	crappie population us
GEN_103050	raccoons and muskrats in us
GEN_103051	average precipitation 1990
GEN_103052	percentage of americans in agraires
GEN_103053	open house policy us
GEN_103054	waypoints by state
GEN_103055	percentage of americans in the usa
GEN_103056	united states seas depths average
GEN_103057	time to harvest food
GEN_103058	raptors common house
GEN_103059	pharmacists use e-mail to order medicine
GEN_103060	children in poverty
GEN_103061	us state wildlife refuges
GEN_103062	year average temperature
GEN_103063	market share by us state
GEN_103064	people use social media sites most often
GEN_103065	military personnel retirement homes
GEN_103066	income inequality us
GEN_103067	primary coyotes us
GEN_103068	number of us cities
GEN_103069	us acreage by year
GEN_103070	state heart disease rate
GEN_103071	cirrus population united states
GEN_103072	city of Hartford's grand list for real estate
GEN_103073	people use social media to communicate with each other
GEN_103074	healthcare workers pay higher salaries
GEN_103075	settlement rate in saguaro state
GEN_103076	agribusinesses us
GEN_103077	squirrels and deer
GEN_103078	sheep population growth
GEN_103079	number of us elk
GEN_103080	salem county population vs. us
GEN_103081	marsh and grassland use statistics
GEN_103082	medical billing services us
GEN_103083	number of ships in circulation
GEN_103084	low water temperatures
GEN_103085	one-time payment processing time
GEN_103086	average recharge rate
GEN_103087	snowshoe hare population us
GEN_103088	cost of operating equipment
GEN_103089	trees are a major problem in the usa
GEN_103090	percentage americans in the usa
GEN_103091	construction related traffic accidents
GEN_103092	tree species diversity
GEN_103093	corn is most common food in us
GEN_103094	common reed population us
GEN_103095	a total of 67,016 people
GEN_103096	average depth of water
GEN_103097	cadmium concentrations
GEN_103098	hospital population by state
GEN_103099	us vegetable industry
GEN_103100	plows are banned in the area
GEN_103101	expenses by state
GEN_103102	fishes and frogs
GEN_103103	us population statistics by state
GEN_103104	north carolina state population
GEN_103105	university collections decrease
GEN_103106	agricultural land area
GEN_103107	average current price
GEN_103108	coldwater national park
GEN_103109	list of butterflies us
GEN_103110	average flight time
GEN_103111	average cost of ownership
GEN_103112	students are enrolled in a university or college
GEN_103113	commercial salt production industry us
GEN_103114	average weight of wolves
GEN_103115	data center capacity by country
GEN_103116	the number of people hunting in us
GEN_103117	seabirds and marine mammals
GEN_103118	pressure wells us
