GEN_101127	number of americans employed
GEN_101128	wetland classifications
GEN_101129	phylogenetic diversity of americans
GEN_101130	logistics cost per second
GEN_101131	us wildland population
GEN_101132	the united states rivers and lakes
GEN_101133	trapping is a form of animal husbandry
GEN_101134	fishes in awe
GEN_101135	list of launch vehicles used by us
GEN_101136	percentage of veterans in the military
GEN_101137	golf course popularity
GEN_101138	crabs eat apples
GEN_101139	maintenance and repair items
GEN_101140	rice lake fires per year
GEN_101141	total number teachers us
GEN_101142	floods natural gas
GEN_101143	2016 Census data
GEN_101144	mortgage interest rate by state
GEN_101145	us mosquitoes are a problem. us
GEN_101146	percentage of people in a house
GEN_101147	volunteer summers
GEN_101148	month droughts average
GEN_101149	number of us muskrats
GEN_101150	inventory levels by state
GEN_101151	application outcomes retirement savings employees
GEN_101152	grain industry us
GEN_101153	shipping industry share
GEN_101154	common reference number
GEN_101155	state insurance premiums
GEN_101156	no parking zones
GEN_101157	average hospital admissions rate
GEN_101158	us coastlines by state
GEN_101159	number of homes per month
GEN_101160	cruise ships traffic congestion
GEN_101161	each month us taxpayers commit to a program
GEN_101162	use of water by state
GEN_101163	cereals us
GEN_101164	cnn usa census data
GEN_101165	low-income people in western america
GEN_101166	tin, zinc, and chromium content
GEN_101167	newspaper article by john mccartney
GEN_101168	water supply by state
GEN_101169	people who work in the military
GEN_101170	congressional staffing industry
GEN_101171	state public schools
GEN_101172	crime rate by state
GEN_101173	right of way permits us
GEN_101174	construction and maintenance projects
GEN_101175	settlement rate by state
GEN_101176	fishes in ponds
GEN_101177	foot traffic by state
GEN_101178	common hospitalizations
GEN_101179	us humidity levels
GEN_101180	us ozone level
GEN_101181	us household income by state
GEN_101182	hunting recreational uses us
GEN_101183	white house staffing ratio
GEN_101184	land area in the us
GEN_101185	elementary and secondary school students united states
GEN_101186	wheat stubble and litter
GEN_101187	united states fisheries industry share
GEN_101188	how many people use google translate?
GEN_101189	common cold us
GEN_101190	us social security number
GEN_101191	mobile population by state
GEN_101192	city halls in san francisco
GEN_101193	migration statistics by state
GEN_101194	lake wetlands diversity us
GEN_101195	railroads by state
GEN_101196	milk production by us state
GEN_101197	wood industry statistics
GEN_101198	sport tourism industry
GEN_101199	school year 1946
GEN_101200	us per capita
GEN_101201	BP America cltr
GEN_101202	average daily fishing trip
GEN_101203	average price of gasoline
GEN_101204	fleet size by state
GEN_101205	may-july period
GEN_101206	chemical workers us
GEN_101207	ducks and geese population
GEN_101208	average age of a buck
GEN_101209	questions and answers
GEN_101210	number of americans in retirement
GEN_101211	houses in new york city that housed the world's top musicians
GEN_101212	tourists number
GEN_101213	average price of real estate
GEN_101214	farmers market share
GEN_101215	public utilities budgets
GEN_101216	fishes by state
GEN_101217	whitetails are the most common species
GEN_101218	apple, peach, and pear
GEN_101219	high levels of narcotics in us
GEN_101220	petrochemicals exports
GEN_101221	asian population growth
GEN_101222	historic buildings built in the us
GEN_101223	number of us fish
GEN_101224	us grassland population
GEN_101225	summarization of financial transactions
GEN_101226	irrigation industry population
GEN_101227	people living in u.s
GEN_101228	bank statistics number
GEN_101229	average daily consumption by us citizen
GEN_101230	average UV intensity
GEN_101231	mines operating cost
GEN_101232	number of schools per year
GEN_101233	police department statistics by state
GEN_101234	factsheet summary
GEN_101235	military personnel united states
GEN_101236	housing stock market share
GEN_101237	number of people working in the pea island area
GEN_101238	burning fuels us
GEN_101239	how many people use a computer
GEN_101240	average soybean yield
GEN_101241	Agricultural research and development state
GEN_101242	human population united states
GEN_101243	average ice thickness
GEN_101244	city hall buildings erected in u.s
GEN_101245	public use of wetlands us
GEN_101246	us national parks and reserves
GEN_101247	rice fields us
GEN_101248	memorandums and letters us
GEN_101249	american wetlands number
GEN_101250	cows killed in us
GEN_101251	waterbirds us
GEN_101252	us gdp growth
GEN_101253	us population
GEN_101254	caribou, brown bear, walrus, and otters
GEN_101255	university enrollment rate
GEN_101256	us state of the art medical equipment
GEN_101257	department of recreation
GEN_101258	water quality by state
GEN_101259	marine industry share
GEN_101260	us geological state population
GEN_101261	small asphalt repairs us
GEN_101262	us population 5000
GEN_101263	us fish stocks
GEN_101264	arts foundations philanthropy
GEN_101265	number of people working in the food industry
GEN_101266	university research budget decline
GEN_101267	funding for the st. john's university research institute
GEN_101268	cost of irrigation system
GEN_101269	total number americans in office
GEN_101270	number of people working in the city
GEN_101271	the u.s. economy by state
GEN_101272	average elevation mountains us
GEN_101273	moose population in us
GEN_101274	fish catches by state
GEN_101275	users share information with others
GEN_101276	house prices by state
GEN_101277	shipping industry by state
GEN_101278	us river basins
GEN_101279	current state of the us
GEN_101280	fishes grazing area us
GEN_101281	state temperatures average
GEN_101282	number americans living in poverty
GEN_101283	water quality us
GEN_101284	amount of rice us
GEN_101285	women's swimming pool population
GEN_101286	common spicebush
GEN_101287	trapping animals by state
GEN_101288	tree species us
GEN_101289	business partnerships us
GEN_101290	average weight by state
GEN_101291	bald eagle nests in the us
GEN_101292	statistics us vs. europe
GEN_101293	bulls and cows
GEN_101294	average pressure in april
GEN_101295	poor weather in utah
GEN_101296	hospitals by state
GEN_101297	leadville population 2,000
GEN_101298	common and thick-billed pigeons
GEN_101299	fire department response times
GEN_101300	us visitor numbers
GEN_101301	marines use a compass to get around the world
GEN_101302	percentage females us
GEN_101303	most common forest
GEN_101304	muskrats and raccoons
GEN_101305	us hunting population
GEN_101306	number of households
GEN_101307	us bald eagle population
GEN_101308	bikeshare us
GEN_101309	storms average rainfall
GEN_101310	monthly weather forecasts
GEN_101311	united states fall weather
GEN_101312	people can't walk or talk in a wheelchair
GEN_101313	us dryland area
GEN_101314	us coastlines open spaces
GEN_101315	summaries of u.s. waterways' use
GEN_101316	us hares population
GEN_101317	common eiders us
GEN_101318	us sewage use by state
GEN_101319	number of people in us
GEN_101320	united states election results
GEN_101321	city bikeways us
GEN_101322	average length of stay
GEN_101323	management of a mule urchin
GEN_101324	school year average number students
GEN_101325	animals protected by united states us
GEN_101326	AGE PER MONTH
GEN_101327	us butterfly population
GEN_101328	lead consumption by us citizen
GEN_101329	heavy metals and toxins
GEN_101330	us rat population
GEN_101331	number of states with a legislature
GEN_101332	nutria, raccoon, fox, opossum, and foxes
GEN_101333	american alligators
GEN_101334	cold water rafting season
GEN_101335	average hospital admission rate
GEN_101336	parking lot size by state
GEN_101337	christmas trees by state
GEN_101338	estonia harbor area
GEN_101339	us lakes and rivers
GEN_101340	most common carnivorous foods us
GEN_101341	dry season
GEN_101342	us fbi statistics
GEN_101343	foreign investment total
GEN_101344	use of a car in europe
GEN_101345	annual revenue
GEN_101346	payors by state
GEN_101347	property tax rate by state
GEN_101348	more than 200,000 people working in u.s
GEN_101349	state infectious diseases rate
GEN_101350	list of refuges us
GEN_101351	us rivers flooding yea
GEN_101352	us electricity demand
GEN_101353	us forest industry
GEN_101354	university students number of jobs
GEN_101355	united states hunting season
GEN_101356	number of cars sold per year
GEN_101357	sandhill cranes average number in us
GEN_101358	us army personnel
GEN_101359	us rivers lakes ponds wetlands number
GEN_101360	cause of death accident
GEN_101361	percentage trees us
GEN_101362	list of endangered species us
GEN_101363	fires in us state
GEN_101364	average daytime temperature
GEN_101365	multifamily payments total
GEN_101366	us military personnel
GEN_101367	us mourning population
GEN_101368	cities population 2 million
GEN_101369	adak tourism industry by state
GEN_101370	horseback riding statistics
GEN_101371	public access to zoos
GEN_101372	last trip to the us
GEN_101373	the proposed islands national wildlife refuge
GEN_101374	liquefaction and landslide statistics
GEN_101375	waterfowl population ages 1 to 3
GEN_101376	us state population compared to other states
GEN_101377	us federation
GEN_101378	us population share
GEN_101379	common house price
GEN_101380	long-billed dowitcher population united states
GEN_101381	statistics of population us
GEN_101382	cross country trails development
GEN_101383	waste management industry
GEN_101384	call center location
GEN_101385	common crocodiles us
GEN_101386	water quality improvement projects
GEN_101387	united states airports population
GEN_101388	grain prices us
GEN_101389	us camera industry by year
GEN_101390	lake waters average daily temperature
GEN_101391	average expenditure by state
GEN_101392	trapping industry us
GEN_101393	us wetlands are a major irrigated area
GEN_101394	corn production industry us
GEN_101395	cold springs state park system
GEN_101396	united states rivers swamps
GEN_101397	largemouth bass population united states
GEN_101398	salacar industry
GEN_101399	united states farmland population
GEN_101400	veterans deaths per second
GEN_101401	us aquifers demand
GEN_101402	us wildlife abundance
GEN_101403	city councils and municipalities
GEN_101404	us state oceans
GEN_101405	number of employees by state
GEN_101406	fishes in the usa
GEN_101407	city streets busy times
GEN_101408	us public lands
GEN_101409	mortgage loan default rate
GEN_101410	state wildlife resources number
GEN_101411	cattails eat grass
GEN_101412	recent crop statistics
GEN_101413	canals and rivers in the us
GEN_101414	people living in poverty areas
GEN_101415	department of defense
GEN_101416	dams floods natural resources
GEN_101417	us mobile phone penetration rate
GEN_101418	us prognostic experts share their views on the future
GEN_101419	us marshland population
GEN_101420	humanities councils united states
GEN_101421	fishes vs. species
GEN_101422	number of cars stolen in us
GEN_101423	average dry weight
GEN_101424	hurricanes in usa
GEN_101425	collisions by train
GEN_101426	vines are a common food storing method
GEN_101427	people living in poverty
GEN_101428	average number of americans in college
GEN_101429	military personnel statistics us
GEN_101430	political boundaries of the united states
GEN_101431	floods natural resources area
GEN_101432	forest industry us
GEN_101433	oil industry us
GEN_101434	food security state us
GEN_101435	police station population
GEN_101436	airlines flight times per year
GEN_101437	fires in april
GEN_101438	average number of americans in the armed forces
GEN_101439	us economy is in decline
GEN_101440	population density cities us
GEN_101441	utility industry growth
GEN_101442	state refuges & flora
GEN_101443	submerged ice cream market
GEN_101444	carp population by state
GEN_101445	united states droughts in the past year
GEN_101446	city planning codes
GEN_101447	change in gdp by us state
GEN_101448	us water level by state
GEN_101449	woods ice cream price
GEN_101450	average number of people working in agriculture
GEN_101451	unincorporated state
GEN_101452	simenof national park
GEN_101453	fisheries management statistics us
GEN_101454	us precipitation rate
GEN_101455	wheatgrass population in us
GEN_101456	list of footnotes
GEN_101457	average food value
GEN_101458	people stopped for questioning and complainants
GEN_101459	average number of us citizens
GEN_101460	recent insurance premiums
GEN_101461	average number of people working in a given industry
GEN_101462	management of public land
GEN_101463	average cruise price
GEN_101464	fishes eat a variety of foods
GEN_101465	animals killed by foxes
GEN_101466	electrical and mechanical codes
GEN_101467	number of students in high schools
GEN_101468	transit use by us population
GEN_101469	average age of people working in the financial services industry
GEN_101470	hunting season in seneca county
GEN_101471	many people web site ad revenue
GEN_101472	number of people working in a u.s. office
GEN_101473	us waterways population
GEN_101474	average monthly rainfall
GEN_101475	theodore r. stevens national park complex us
GEN_101476	us coastlines region
GEN_101477	us office space demand
GEN_101478	children's books sold in us
GEN_101479	average calorie intake us
GEN_101480	business owners share information with others
GEN_101481	fish species diversity
GEN_101482	cloud cover by us state
GEN_101483	public hearings scheduled for 2018
GEN_101484	cannibals in the us
GEN_101485	number of people in poverty
GEN_101486	hunting season average
GEN_101487	average number of people working in a restaurant
GEN_101488	us malformed frogs
GEN_101489	average number of americans
GEN_101490	number of hospice beds us
GEN_101491	division of real estate
GEN_101492	number of people working in the entertainment industry
GEN_101493	recent growth rate
GEN_101494	united states population 12,000
GEN_101495	us sediments concentrations
GEN_101496	small mammals population
GEN_101497	average retirement savings amount
GEN_101498	rainfall average us
GEN_101499	corals in the usa
GEN_101500	mortgage rate us
GEN_101501	net income from operating expenses
GEN_101502	food insecurity us
GEN_101503	sea level rises
GEN_101504	sports tourism industry share
GEN_101505	pondberry population united states
GEN_101506	percentage americans in factories
GEN_101507	average withdrawals by state
GEN_101508	cropland management district united states
GEN_101509	shipwrecks us
GEN_101510	manua city center area
GEN_101511	average number of lawyers
GEN_101512	traps used in saturday and sunday markets
GEN_101513	oil prices volatile
GEN_101514	us equine population
GEN_101515	american polar bears
GEN_101516	city average building energy consumption
GEN_101517	yearly average cost of living
GEN_101518	rivers flood plains us
GEN_101519	percentage of americans in private sector
GEN_101520	total number university research assistants
GEN_101521	many people in the us hospital system
GEN_101522	people living in a house
GEN_101523	schools in texas
GEN_101524	mishaum peninsula area inland waters
GEN_101525	us line islands
GEN_101526	number of us animals
GEN_101527	percentage of women in factories
GEN_101528	people with disabilities ride in vehicles
GEN_101529	usa population
GEN_101530	average daily energy consumption
GEN_101531	average daily consumption
GEN_101532	percentage of americans in public schools
GEN_101533	current supervisory district united states
GEN_101534	use of the web browser
GEN_101535	lake population 2 million
GEN_101536	lake unoccupied by cars
GEN_101537	united states seas and oceans average
GEN_101538	cadmium and fluoride concentrations
GEN_101539	americans living in adak islands
GEN_101540	number of people working in a university
GEN_101541	number of libraries in the united states
GEN_101542	united states forests average annual growth
GEN_101543	us embassy in london
GEN_101544	precipitation by state
GEN_101545	state wildlife management system
GEN_101546	city parks open space
GEN_101547	rivers and lakes in america
GEN_101548	us marsh population
GEN_101549	us air traffic accidents every year
GEN_101550	lake migratory population
GEN_101551	bill in 84th congress
GEN_101552	annual water quality estimate
GEN_101553	us cratonic age group
GEN_101554	us grasses state
GEN_101555	school bus service us
GEN_101556	food production capacity united states
GEN_101557	cattle number
GEN_101558	us natural resources
GEN_101559	us mountaineers
GEN_101560	ponds in usa
GEN_101561	city councils and parking agencies
GEN_101562	public information campaign
GEN_101563	timeline of missions us
GEN_101564	us population 2000
GEN_101565	population density rural areas
GEN_101566	number of people working in fishing
GEN_101567	concrete foundations and other structures
GEN_101568	milk production industry us
GEN_101569	us hog population
GEN_101570	number of americans in military
GEN_101571	number of people employed
GEN_101572	birds eat human food
GEN_101573	us shorebird population
GEN_101574	turkeys eat fish
GEN_101575	us rivers flooding rate
GEN_101576	us rainfall average
GEN_101577	percentage americans working in construction industry
GEN_101578	fisheries management practices
GEN_101579	number of ships in us
GEN_101580	annual population growth
GEN_101581	monthly average number of americans in the us
GEN_101582	number of homes in a city
GEN_101583	marathon pipelines us
GEN_101584	statistics and economic development
GEN_101585	birds eat human flesh
GEN_101586	us petroleum industry share
GEN_101587	number of airlines in us
GEN_101588	construction workers us
GEN_101589	oil prices by state
GEN_101590	average reflectance factor
GEN_101591	list of butterflies in us
GEN_101592	americans living in a house
GEN_101593	muskrat population united states
GEN_101594	average interest rate
GEN_101595	cruise ship shipwrecks us
GEN_101596	public schools us
GEN_101597	metal concentrations
GEN_101598	% of americans in college
GEN_101599	city population 20,000
GEN_101600	precipitation average by state
GEN_101601	monthly average number of people in the us
GEN_101602	average nesting rate us
GEN_101603	fishes eat frogs
GEN_101604	fisheries state us
GEN_101605	volunteers' rights in the us
GEN_101606	political party size by state
GEN_101607	state income tax rate county average
GEN_101608	bulls eat vegetables
GEN_101609	unsupervised classification seafloors
GEN_101610	road construction waste
GEN_101611	city streets numbered by county
GEN_101612	united states winters and summers
GEN_101613	catch of salmon
GEN_101614	coal prices us
GEN_101615	number of us deserts
GEN_101616	number of military members us
GEN_101617	us household income
GEN_101618	stream width by state
GEN_101619	percentage americans working in energy
GEN_101620	spending by state
GEN_101621	small game population
GEN_101622	rivers basins area
GEN_101623	us pipeline industry
GEN_101624	lake water quality by state
GEN_101625	city offices and restaurants
GEN_101626	number of flights per day
GEN_101627	hay production by state
GEN_101628	field work by state
GEN_101629	us deep sea fishing industry share
GEN_101630	number of people working in a hospital
GEN_101631	average peat density
GEN_101632	university students use public transportation
GEN_101633	individuals or businesses
GEN_101634	us state of the art e-mail marketing industry
GEN_101635	brown bear population
GEN_101636	united states refugee population
GEN_101637	state average hospital admission rate
GEN_101638	livestock number us
GEN_101639	population of pigs
GEN_101640	number of homes per year
GEN_101641	lake system us
GEN_101642	american population density
GEN_101643	statistics traffic accidents us
GEN_101644	us porous material concentrations
GEN_101645	number of people working in a manufacturing facility
GEN_101646	state water quality statistics
GEN_101647	farmers in us
GEN_101648	us army budgets
GEN_101649	united states elk population
GEN_101650	turkeys and other animals killed each year
GEN_101651	results for year 2009
GEN_101652	us open market
GEN_101653	travel time by country
GEN_101654	united states grasslands us
GEN_101655	us salt water levels
GEN_101656	total number of jobs
GEN_101657	number of people driving cars
GEN_101658	reefs protected by u.s. law
GEN_101659	sockeye salmon population
GEN_101660	industrial activity by state
GEN_101661	cattle growing in us
GEN_101662	petrified forests us
GEN_101663	state frog population
GEN_101664	aerial photograph of the refuge taken on June 24, 1968
GEN_101665	us forests are a major agricultural area
GEN_101666	avian deaths per year
GEN_101667	statistics open data portal
GEN_101668	bull trout population us
GEN_101669	cross-country skiers vs. riders
GEN_101670	number of us
GEN_101671	car wrecks per year
GEN_101672	us soil moisture
GEN_101673	lead poisoning outbreaks
GEN_101674	fire safety us
GEN_101675	reptiles and other small mammals
GEN_101676	transit use by us state
GEN_101677	statistics us salt lakes region
GEN_101678	lion fish vs. cichlids
GEN_101679	fifty-one tropical cyclones recorded in u.s
GEN_101680	infant mortality rate
GEN_101681	letters of intent
GEN_101682	different types of wildlife us
GEN_101683	hospital beds capacity decreases
GEN_101684	percentage us citizens married
GEN_101685	total water salinity us
GEN_101686	average precipitation 2013
GEN_101687	increasing number of americans in the workforce
GEN_101688	individual artist salaries
GEN_101689	people use public transportation system
GEN_101690	snowy weather forecasts
GEN_101691	us dryland population
GEN_101692	meteorological activity by state
GEN_101693	average brightness by year
GEN_101694	ship speed by year
GEN_101695	united states mangroves
GEN_101696	household incomes by state
GEN_101697	americans employed by state
GEN_101698	lost woods county area
GEN_101699	ocean depths average
GEN_101700	public transportation demand by us state
GEN_101701	FAQs for flying machines
GEN_101702	united states exchange rate
GEN_101703	smoke and gas concentrations
GEN_101704	commercial timber harvesting industry
GEN_101705	united states burying population
GEN_101706	marsh at northwest corner of state and open to public
GEN_101707	survey respondents number
GEN_101708	us cruise ship traffic accidents
GEN_101709	each year more than 1 million americans live in a home
GEN_101710	us temperature rise
GEN_101711	public access to a variety of services
GEN_101712	cat food consumption by state
GEN_101713	average forage production us
GEN_101714	percentage of americans in asian country
GEN_101715	land area in the state of Alaska
GEN_101716	number of people traveling by state
GEN_101717	abundance of ice cream in usa
GEN_101718	fire department statistics
GEN_101719	us grasslands population
GEN_101720	red fox, muskrat, raccoon, and striped skunk
GEN_101721	industrial production capacity
GEN_101722	criminal offenses reported by university students
GEN_101723	cost effective operating systems
GEN_101724	aerial photographs of the united states
GEN_101725	outpatient hospitalization rate
GEN_101726	fishes vs. frogs
GEN_101727	average power consumption
GEN_101728	basic electricity demand by us state
GEN_101729	us motorcycle traffic share
GEN_101730	storms in california
GEN_101731	number of us drugs sold
GEN_101732	presentation by sri nra winners
GEN_101733	cost of government IT infrastructure improvements
GEN_101734	percentage of americans in nursing home
GEN_101735	us spawning animals
GEN_101736	percentage of americans in affluent states
GEN_101737	congressman san frantois
GEN_101738	volunteers help us control weeds
GEN_101739	united states wildlife number
GEN_101740	water use statistics us
GEN_101741	business owners share common stock
GEN_101742	marsh area state
GEN_101743	annual salary average americans
GEN_101744	homeless person united states
GEN_101745	statistics us daily population
GEN_101746	how many people live in a house?
GEN_101747	food waste management united states
GEN_101748	us inland waters area
GEN_101749	united states agriculture industry share
GEN_101750	muskrats, raccoons, opossums, and coyotes a common problem
GEN_101751	monitoring and restoration of the Humbug Marsh
GEN_101752	risk assessment of metric instruments
GEN_101753	average daily intake of mercury
GEN_101754	bill in the 94th congress
GEN_101755	education technology workforce us
GEN_101756	state legislatures to ban instant kill traps
GEN_101757	cottages rented out by owners
GEN_101758	number of cars per day us
GEN_101759	average daily sunlight output
GEN_101760	copper content in blood
GEN_101761	methane emissions by us state
GEN_101762	heavy grazing by us citizens
GEN_101763	lake water level by state
GEN_101764	congressman sandra antonio
GEN_101765	parking lot patrols us
GEN_101766	us rivers lakes area
GEN_101767	land use average
GEN_101768	demand for food by us state
GEN_101769	lake population 1 million
GEN_101770	agribusiness industry statistics us
GEN_101771	solar basins are a common ecological phenomenon
GEN_101772	us geography data
GEN_101773	sheep population united states
GEN_101774	united states rivers deposits
GEN_101775	weather forecasts year-round
GEN_101776	us population 2.4%
GEN_101777	average brightness by state
GEN_101778	number of people with disabilities
GEN_101779	number of miles traveled per day
GEN_101780	us outpatient population
GEN_101781	lake riprap needs repair
GEN_101782	food web traffic statistics us
GEN_101783	bank foreclosures vs. other financial institutions
GEN_101784	us national parks population
GEN_101785	lake system state
GEN_101786	common breeding grounds
GEN_101787	us cloud cover
GEN_101788	most common carnivorous species
GEN_101789	common household income
GEN_101790	air traffic control system us
GEN_101791	city streets busy
GEN_101792	total number americans
GEN_101793	BSCW grids are not yet available
GEN_101794	price of rice
GEN_101795	average refuge activity
GEN_101796	2014 financial year
GEN_101797	salt marsh area us
